Character Name,Dialogue
米里斯,累死了，好累……
椿,……苍蓝残响究竟有何图谋？
米里斯,操那心干啥？这要怎么向协会报告啊……
椿,能怎么办。按我们的所见所闻如实汇报。那可不是能够应付的对手。
椿,不说咱们，2科前往图书馆后杳无音信。是出了什么事吗？
米里斯,弟兄们都累昏头了。邵科长也操劳过度了吧。
米里斯,嗐，这会儿可没功夫瞎操心别人。还有挺多东西要整理的，别磨磨唧唧了。
椿,科长大人。这么晚打扰您真是万分抱歉。有关近来接手处理的各个案件，在下有一言……
米里斯,……科长大人？
邵,……
邵,……啊，抱歉。刚刚在想别的事情。不用在意。
邵,说回报告。有何要事？
椿,除了捕获失败的哭泣之子，其余扭曲标本已交由数名专人提取并转交V公司。
米里斯,工期说是差不多得要一天。咱们要一直待到那时候吗？
椿,可曾收到来自协会长或运营团队那边的联络。
邵,1科受命，退出此次事件。
邵,据悉，今后图书馆和扭曲相关事宜将视情况交予하나协会处理。
米里斯,有关都市之星图书馆，似乎必须得花上更多时间去分析研讨呢……
椿,所以现在要撤离这座巢了吗。
邵,是的。标本提取后即刻返程，提前打点好行囊。
邵,此前为下次行动各行整备。不知会有什么委托，先行休养生息罢。
米里斯,好嘞，得令。
椿,那么科长大人还请休憩，在下先行……
邵,留步。
邵,从现在起，铭记我说的每一句话。
邵,1科极有可能被派遣至环指与小指交火的郊区。
邵,我们应当重点关注小指，若是被派遣，各位请务必做好心理准备。
椿,得令。
邵,米里斯最大的缺点就是伐功矜能。只要留意这点，日后便不会有什么问题。
邵,椿如此这般日益精进。有朝一日也会拥有被赋予色彩的资格。
椿,突然说这些……
邵,……
米里斯,……莫非是收到了其它报告。
邵,不。先前已经全部说过了。
邵,此外，我收到了图书馆的邀请函。正堂而皇之地摆在桌上。
椿,所以适才……
邵,没错……我将因此辞去六协会1科科长的职务。
米里斯,……
邵,单方面退出协会以及撕毁合同所造成的损失都将由我独自承担。
米里斯,那……您的意思是。
邵,你们无须担心此事影响你们的过往经历。
米里斯,扯啥有的没的！
邵,后边的包里有我整理收集的交接必需信息文件。
邵,或许有所缺漏……但现在时间紧迫无法返回协会总部，还请谅解。
邵,我为唐突离席向各位深表歉意。
椿,果然还是要去图书馆吗。
邵,……
椿,这可不像邵科长。您可知这绝非能够草率决定的事情……
椿,先行回到协会收集更多信息，如何？这必将大有裨益。
邵,你说得对。不像我，这真是不像我……
邵,太不像了……第一次流泪。我本以为和这种感情无缘。
邵,罗威尔千叮咛万嘱咐过。无论对方发生什么，也不得放弃生命。
邵,多么理所当然的事……我本以为我能保持冷静。
邵,一但亲身遭遇却无论如何都无法割舍，我唾弃这样的自己。
邵,愤怒……失爱、绝望、悲痛。
邵,如何辨明这份感情……不得而知。
邵,但有一点确信无疑。
邵,我走到今天这一步，早已见过无数的谎言。
邵,我本以为这座都市中只存在伪装成真实的谎言。我也曾如此行事。
邵,但是，我对罗威尔的心，是真实的。
椿,科长大人，您的心情并非无法理解。
椿,然而就此辞职，着实弊端多多。
椿,与协会间的信任被打碎，即使日后再独自设立事务所，也会被排斥在这个圈子之外。不仅如此，还有……
邵,就算这样！
邵,我可曾在这都市中这般心急如焚。
邵,可曾为离别心如刀绞。
邵,可曾为思念痛哭流涕……
邵,多亏了罗威尔，我终是知晓了这份心意如此真实。
邵,正因如此，燃尽我身才足以作为我曾活过的证明。
椿,怎能如此冠冕堂皇地说出来。罗威尔科长也是，您也是……
米里斯,邵……我有一个问题。
米里斯,搞到罗威尔的书，然后呢。想过之后要咋整吗？
邵,……不，没有。我只是想贯彻本心。
米里斯,像你这种收尾人在这种情况下意气用事，会有什么下场很明显了吧。
米里斯,你想无路可退吗？
邵,就算终有一日我的空中星光掠现，无人相伴又有什么意义呢……
邵,我心已决。固不可彻。
椿,您可知我等必将追随。
邵,……或多或少。
椿,不加劝阻么……
邵,随我来的话……夺取书籍的概率便能提升。
椿,着实自私。
椿,从未见过如此失态的您都这样说了……我等无可非议。
邵,绝非强求。你们有选择的自由。
邵,但若仍愿意追随如此不成器的我……此份恩情，惟以毕生奉还。
罗兰,……我这看到啥了？
安吉拉,和你说的相反，身为协会1科科长的收尾人也会做出如此感情用事的判断。
罗兰,我也吓了一跳。那个邵她瞎了吗……
罗兰,果然，白夜黑昼的光芒并不只是影响了扭曲或E.G.O的产生……
罗兰,看看这群来宾，该怎么说呢……他们在情感上更加坦率了吗。
安吉拉,到目前为止，事实的确如此。
安吉拉,并非无法理解。你要是出了什么事，我也……
罗兰,……啊？这话我……
罗兰,但是我还没做好心理准……
安吉拉,唉……罗兰。千万别再说那种傻话了。
安吉拉,我比任何人都清楚，这绝非爱情之类的情感。
罗兰,我懂我懂。再找个像我这样能唠的家伙可不容易喽？
安吉拉,是的。和你这种人建立朋友关系令人身心俱疲。
米里斯,到底还是来这图书馆了。
椿,分部长怒发冲冠的模样依旧历历在目。
邵,满腹愧疚。
米里斯,还能咋办。这是咱自找的。
米里斯,来都来了，就好好干正事呗。
椿,如果在图书馆收获一定战果，或许可以酌情考量。
邵,我大可埋骨于此。
邵,但你们必须将自身性命置于首位。
邵,我也知道和随我而来的你们说这些话，实在无地自容。
椿,那可真是太不要脸喽。谁都不会死的，我们将凯旋而归。
米里斯,要是被六协会炒了，您可得记着赔咱饭钱唷。
邵,那是自然。
安吉拉,各位来宾，欢迎你们的到来。
安吉拉,我是图书馆的馆长兼司书，安吉拉。
邵,很高兴认识你这种话可说不出口，但姑且还得遵守礼节……
邵,我的名字是邵。这两位是椿和米里斯。打个招呼吧。
椿,……你好。
安吉拉,……嗯，谢谢。
安吉拉,……
米里斯,杵哪儿干啥呢。这会儿又有负罪感了？
安吉拉,……
安吉拉,你们不是知道的吗？身着相同制服的那些来宾的下场。
邵,……确实。
安吉拉,尽管如此，您还是做此选择。并没有任何人强迫。
米里斯,……真就一派胡言张口就来是吧。
椿,说得好像我们的死是理所当然。
邵,你们两人，退下。你的重点是？
安吉拉,对我不理解的人类心理的疑惑……仅此而已。
安吉拉,不惧眼前的危险也想要夺回的理由。
安吉拉,我也，不……我见过无数次。寻找替代品的故事。
安吉拉,所以，比生命还重要这种话是我无法理解的部分。
邵,总能找到替代品吗？
安吉拉,正是如此。所以不必放弃更加珍重的生命。
邵,机器是无法理解的。为了珍重的事物热血沸腾的感觉。
邵,无论用什么方法，无论用什么方式都要夺回的心情。
邵,绝非如你所说得那般轻描淡写。重要的话语……
邵,梦、希望、价值观、触动人心、延续生命等一切字眼……
邵,重要的意义是难以言喻的宏伟……而单纯。
安吉拉,但这远远不足以成为牺牲自己生命的理由。
邵,无法否认。在失去珍重之物时，各人克服的方式也不尽相同。
安吉拉,那么，如此威风凛凛地来到这里，是因为自己的强大而自信吗？
安吉拉,或者仅仅是被愤怒蒙蔽了双眼？
邵,那个啊……我也很好奇。
邵,但我明白，我心中的情感绝非愤怒或悲伤。
安吉拉,唉……
安吉拉,无论如何也不过是空虚的人生。为了存在的理由而自寻死路？
安吉拉,如今充满自信。认为自己固若金汤。
安吉拉,但是，即使眼前出现意想不到的情况……你依旧是牢不可破的吗。
安吉拉,我不这样认为。只会早于所有人，率先崩溃。
安吉拉,最后，即使心怀渺茫的希望，在死亡面前仍是毫无意义。
安吉拉,仅凭你微薄的心境真的能够改变现状吗？
邵,……
椿,……如今你是在劝告我们返回么？
安吉拉,我没有阻止你们的权利。
米里斯,少在那婆婆妈妈的……
米里斯,分明就是看不起人。科长大人，别理她了，咱们进去吧。
邵,……
邵,没错。我希望能在这里找到罗威尔的书。
邵,认为我很强，他人不值一提也好。无情也罢。
邵,他人的目光，我无需在意。
邵,心境无法改变现况？
邵,当然了。只要怀有希望就能见到前途吗。仅有光明就足够了吗。
邵,那与绝望无异……不见前路，何去何从。
邵,就算为我铺下道路……不见光明……相差无几。
邵,然而，若是将此二者分而论之，它们的含义大同小异，却相去甚远。
邵,正道是……当下心中怀抱必行之事，如是得以实现不可行之事。
邵,希望就是，触不可触……及不可及……见不可见。
邵,你的言语无法挫灭我的战意。退无可退……釜已破，舟既沉。
邵,若是无所畏惧，那便放马来吧！
安吉拉,……
安吉拉,愿您找到想要的书。
邵,放手！还没结束……还……！
米里斯,求求你，冷静下来啊，科长大人！
邵,害怕你就自己逃啊……凭什么把我也拽出来！
米里斯,……
罗兰,那个样子……是不是在哪儿见过。
安吉拉,不清楚。无法判断是扭曲还是E.G.O。
罗兰,那小子拽得也太快了吧……根本没看清。
安吉拉,是一时陷入混乱了吗……不知为何要将她拖走。
安吉拉,到底为什么要那样做？
罗兰,那么在意他上司吗……就算能一个人逃出去，也想和她一起活下去。
罗兰,不过被拖出去的那家伙，必胜的战意可不弱啊。
罗兰,他们会再次进入图书馆吗？
安吉拉,或许吧。和往常一样，不知今后会如何发展。
罗兰,确实看到了长出了角和蛇鳞……之类的。
安吉拉,像是处在中间态。应当还在逐渐进行中吧。
安吉拉,无法区分是否是扭曲，只有分毫的差距。仅凭那点难以辨别。
罗兰,这样吗……我是完全搞不懂感情线啥的。
安吉拉,……
罗兰,你在想什么呢。
安吉拉,在郁闷没有明确的答案。
安吉拉,总之还是再观察一段时间。毕竟还不知晓他们现状如何。
